{
  "schema_version": "conveyor.constraint_set@1",
  "plan_revision_id": "plan-revision-001",
  "constraint_set_ref": "artifact://planning/constraints-001",
  "constraint_set_digest": "sha256:bbbbbbbbbbbbbbbbbbbbbbbbbbbbbbbbbbbbbbbbbbbbbbbbbbbbbbbbbbbbbbbb",
  "hard_count": 1,
  "soft_count": 0,
  "status": "valid",
  "constraints": [
    {
      "key": "must-not-change-public-api",
      "kind": "interface",
      "statement": "Public API signatures must remain compatible.",
      "strength": "hard",
      "violation_policy": "block",
      "validation_kind": "static_diff",
      "claim_ref": "claim-001"
    }
  ]
}
